"KeyField","RecordID","MapLoc","PropertyName","LastUpdated","Action_taken","Notes","Notes2"
1,"WL0226","WL0226","Hardscrabble","1999-02-19 00:00:00","name modified","""Hardscrabble Claim Group"" changed to ""Hardscrabble Group""",
2,"WL0236","WL0236","Silver Rock","1999-02-18 00:00:00","HARDFILE changed to ""N""","The material in the file was for the Silver Rock property that became part of the Rainbow Mine.",
3,"WL0258","WL0258","Eastern Star","1999-02-18 00:00:00","location updated","Location  MOVED to the adit symbols near Glidden Pass.",
4,"WL0277","WL0277","Burke Property Prospect","1999-02-19 00:00:00","reference changed","Hobbs and others (1975) map does not cover the area where this property is located.  CRIB printout cites thew Western Mining News 1974-75 directory as its source for this location.",
5,"WL0304","WL0304","Blue Ribbon","1999-02-17 00:00:00","synonym added","Full Moon was the original name of this property, per notes on Mine Inspector's forms.",
6,"WL0371","WL0371","Rainbow","1999-02-18 00:00:00","synonym added","This synonym (Silver Rock) is referenced as a separate property in the 1912 IMIR (p. 180).  The claims were part of the Rainbow by 1914.",
7,"WL0433","WL0433","Beacon Light","1999-02-17 00:00:00","synonym added.","Silver Cliff Prospect added as synonym for Beacon Light, as per notes on WL 433b and WL 437.",
8,"WL0433","WL0437","Silver Cliff Prospect","1999-02-17 00:00:00","data reassigned to this property","As per notes on WL 437, Silver Cliff is believed to be an older name for Beacon Light.",
9,"WL0437","WL0437","Silver Cliff Prospect","1999-02-17 00:00:00","deleted; combined with WL 433","Location in Ransom and Calkins (1908) is same as shown by Hobbs and others (1965) for Beacon Light.",
10,"WL0439","WL0439","Princeton-Magna","1999-02-17 00:00:00","location moved","Location moved to the adit symbol on the opposite side of the South Fork CdA River",
11,"WL0442","WL0442","New York","1999-02-24 00:00:00","synonym added","New York location is from Hobbs and others (1965); Bitter Root Pospect (Ransome and Calkins, 1908; IGS mineral property files) consisted of the New York, Lookout, and Sunflower patented claims.",
12,"WL0442","WL0449","New York","1999-02-24 00:00:00","data moved from WL-449","this is data for the Bitter Root Prospect, which is a synonym for New York.  Both properties are part of the Atlas Group.",
13,"WL0449","WL0449","Bitter Root","1999-02-24 00:00:00","data reassigned to WL 442","Bitter Root is a synonym for the New York Prospect shown on Hobbs and others, 1965, Plate 4.",
14,"WL0445","WL0445","Central Prospect","1999-02-25 00:00:00","synonym added","Property became part of the Atlas Mining Company's holdings in 1926.",
15,"HA0355","HA0355","Eclipse","1999-03-04 00:00:00","location changed","The locations of the Eclipse and the Assault appear to be reversed in Anderson and others (1950).  Umpleby and others (1930, Plate 9) shows the Eclipse in this location.  Other information on the Croesus and surrounding properties supports this location for the property, rather than Anderson's.",
16,"HA0356","HA0356","Assault","1999-03-04 00:00:00","location changed","The locations of the Eclipse and the Assault appear to be reversed in Anderson and others (1950).  Umpleby and others (1930, Plate 9) shows the Hope claims (which are believed to be the same as Anderson's ""Assault Group"") in this location.  Other information on the Croesus and surrounding properties supports this location for the property, rather than Anderson's.",
17,"HA0356","HA0356","Assault","1999-03-04 00:00:00","synonym added.","Anderson and others' (1950) descriptions of the workings on the Eclipse property (which should be the Assault/Hope Mine) correspond to information from the U.S. Bureau of Mines (IGS mineral property files) on the workings on the Hope property.",
18,"HA0357","HA0357","Hope","1999-03-04 00:00:00","deleted; combined with Assault (HA 356)","Cross-referencing between Anderson and others (1950), Umpleby and others (1930), and U.S. Bureau of Mines information shows that Assault and Hope properties should be the same; Anderson's locations for Assault and Eclipse are reversed from what they should be.",
19,"SP0077","SP0077","North Fork Mine","1999-03-09 00:00:00","name changed and synonym added","Property was previously referred to by the company name; name was changed to North Fork Mine, with the company name as a synonym.",
20,"WL0471","WL0471","Vienna International","1999-03-16 00:00:00","synonym and commodity added","Osakis (formerly WL-472) is a synonym for Vienna International; Fe (commodity for Osakis) was added to commodity list",
21,"WL0472","WL0472","Osakis","1999-03-16 00:00:00","location deleted","Osakis is a synonym for Vienna International (WL-471).",
22,"WL0430","WL0430a","Silver Mountain Lead","1999-03-17 00:00:00","deleted; combined with WL-415","Silver Mountain Lead is a synonym for Idaho Silver Prospect (WL-415); Chesson and others (1984) location shown for this property is identical to Hobbs and others (1965) location.",
23,"WL0430","WL0430","Silver Mountain Lead","1999-03-17 00:00:00","deleted","Silver Mountain Lead is a synonym for Idaho Silver Prospect (WL-415); Chesson and others (1984) location is identical to the Hobbs and others (1965) location.",
24,"WL0415","WL0430","Idaho Silver Prospect","1999-03-17 00:00:00","synonym added","Silver Mountain Lead is a synonym for Idaho Silver Prospect (WL-415)",
25,"WL0415c","WL0415","Idaho Silver Prospect","1999-03-17 00:00:00","synonym added","Silver Mountain Lead is a synonym for Idaho Silver Prospect (WL-415)",
26,"WL0561","WL0561","Stonewall Mine","1999-03-17 00:00:00","new property","added from field inspection (Prichard-Eagle Creek FS report, vol. 4).",
27,"WL0562","WL0562","Unnamed Prospect","1999-03-17 00:00:00","new property","added from field inspection (Prichard-Eagle Creek FS report, vol. 4).",
28,"WL0336","WL0336","Missoula Copper Prospect","1999-03-17 00:00:00","synonym added","The Missoula Copper Prospect is also the middle workings of the National Copper Mine (WL-367), as per field inspection report (Coeur d'Alene River Basin, vol. 3).",
29,"HA1000","HA1000","Richard Allen Mine","1999-04-09 00:00:00","reference changed","reference changed from ""Campbell, 1929, 30th Ann. Rept. of Mining Ind. of Id. for 1928."" to ""Lewis, 1991, Oregon State Univ. dissertation.""",
30,"WL0046","WL0046","Terrible Edith","1999-04-13 00:00:00","Ventura codes deleted (production and years fields","codes not needed for on-screen viewing",
31,"SP0053","SP0053","Burnt Cabin Mine","1999-05-12 00:00:00","""Inland Premier"" added as synonym","data from IMIR files and 1924 report by H.M. Childs",
32,"WL0471","WL0471","Vienna-International","1999-05-13 00:00:00","reference changed","reference changed from Umpleby and Jones, 1923, USGS B-732 (which contains only a general description) to Calkins and Jones, 1914, USGS B-540, which contains a description of the property, including the general location (but no map).",
33,"SP0062","SP00062","Idaho Chain Link","1999-05-18 00:00:00","spelling changed","spelling in original reference is ""Idaho Chain Link""; this was changed to the primary name. Spelling in MILS is ""Idaho Chainlink""; this was changed to a synonym.",
34,"SP0291","SP0291","Powhatton","1999-05-18 00:00:00","synonym added","company name added as synonym",
35,"WL0061","WL0061","Clear Grit Group","1999-05-21 00:00:00","name changed from ""Unnamed Prospect""","this site was shown on Hosterman (1956) as an unnamed, closed adit.  Information in the Rooster Goose (WL-98) files indentifies this as the location of the Clear Grit workings (probably the longest tunnel).",
36,"WL0238","WL0230","Mammoth Prospect","1999-05-21 00:00:00","Synonym added","Jumbo Group was given as a synonym for this property on the IMIR annual report forms.",
37,"SP0044","SP0044","Lower Property","1999-06-10 00:00:00","synonym changed","Synonym changed from ""Lucky Joe"" to Lucky Joe Mining Company""; this company had two sets of claims.  Second property needs to be added to database (field inspection number K07299701).",
38,"SP0044","SP0044","Lower Property","1999-06-10 00:00:00","synonym added","""Silver Star Group"" added to synonym list (from company's report to Idaho Mine Inspector).",
39,"SP0397","SP0397","Unnamed location","1999-06-14 00:00:00","new property","added from field inspection (Coeur d'Alene Basin, Secondary Properties, Part D)",
40,"SP0268","SP0268","Silver Belt Prospect","1999-06-16 00:00:00","deleted","this property is the same as Silver Dale and Big Hill (SP-277)",
41,"SP0277","SP0268","Silver Dale and Big Hill","1999-06-16 00:00:00","data reassigned","The Silver Belt Prospect and the Silver Dale and Big Hill are different names (at different times and with different owners) for the same claim block.",
42,"WL0213","WL0213","Belmont Mine","1999-06-23 00:00:00","synonyms corrected","punctuation added to change ""Sanwood-Empress Silver Basin Consolidated Mining Co."" to ""Sanwood-Empress; Silver Basin Consolidated Mining Co.""",
43,"WL0431","WL0431","Gem State Mine","1999-06-25 00:00:00","changed hardfile to ""Y""","found Mine Inspectors forms in another property file.",
44,"HM0206","HM0206","Lolo Creek Placer","1999-06-28 00:00:00","hardfile code changed to ""Y""","file reassigned from HM 211",
45,"HM0211","HM0211","Lolo Creek Placer","1999-06-28 00:00:00","hardfile code changed to ""N""","file reassigned to HM 206; company name in file matches that in production records.",
46,"HM0249","HM0249","Lolo Pass Copper Mine","1999-06-28 00:00:00","property added","This property was originally correlated with HM 212, but the information in the file does not match the USBM information in the MILS records.",
47,"HM0212","HM0212","Lolo Mine","1999-06-28 00:00:00","reference changed","This location came from MILS, not the information referenced from the Mine Inspector's Reports (which is now assigned to property HM 249).",
48,"HM0249","HM0249","Lolo Pass Copper Mine",,"NEED LOCATION",,
49,"WL0503","WL0503","Big Elk Group","1999-06-29 00:00:00","synonym deleted","""Idaho Copper and Gold, Inc."" is a separate property (WL-456) and NOT a synonym for the Big Elk.",
50,"BA0034","BA0034","I.X.L. Mine","1999-08-05 00:00:00","synonym added","Synonym (IXLX) added from Mine Inspector's form.",
51,"BA0053","BA0053","Eagan Mine","1999-08-05 00:00:00","Period Prod updated","Added the year ""1949"" to the PERIODPROD field.  It was previously omitted.",
52,"BA0061","BA0061","Black Hawk Mine","1999-08-05 00:00:00","Ore field updated","Corrected the entry in the Ore field from ""A ton/A ton"" to ""A ton""  (No tailings were reprocessed at this mine).",
54,"BO0219","BO0219","Bergdahl No. 1 Well","1999-08-06 00:00:00","Renamed ""Deposit""","Renamed from ""Berglund"" to ""Bergdahl"" seeing as the State Mine Inspector's Reports and the Cited Reference both have ""Bergdahl"" as the name, the other must have been a transcription error.",
55,"BO0220","BO0220","Bergdahl No. 3 Well","1999-08-06 00:00:00","Renamed ""Deposit""","Renamed from ""Berglund"" to ""Bergdahl"" seeing as the State Mine Inspector's Reports and the Cited Reference both have ""Bergdahl"" as the name, the other must have been a transcription error.",
56,"BO0012","BO0012","Marine","1999-08-09 00:00:00","Add Production Information","The production information was not included in the database.",
58,"BO0149","BO0149","Morning Star Mine","1999-08-09 00:00:00","Updated Commod field","Added ""Cu: A oz"" because it was not entered for this property in the database.",
59,"BO0153","BO00153","Black Jack","1999-08-09 00:00:00","Updated Ore field","Changed from ""G ton/A ton"" to ""I ton/A ton"" due to the recorded amount is in the ""I"" range, not the ""G"".",
60,"BO0157","BO00157","American Eagle","1999-08-09 00:00:00","Added Production Information","Added information for Period Prod (1914- 1917, 1928, 1934); Ore (D ton); and Commodity (Au: C oz; Ag: G oz) as per indicated.",
61,"BO0410","BO0410","Berg Mine","1999-08-09 00:00:00","Changed Ore field","Changed Ore field from ""A ton/A ton"" to ""E ton/A ton"" ot make it the same as record.",
62,"BO0085","BO0085","DeLamar Placers","1999-08-09 00:00:00","Updated Ore field","Changed ore value from ""G"" to ""J"" as per records.",
63,"BO0149a","BO00149a","placer production","1999-08-09 00:00:00","Updated Ore field","Changed ore value from ""A"" to ""H"" as per record.",
64,"BO0302","BO0302","North Star Mine","1999-08-09 00:00:00","Added Production Data","Added production data to PeriodProd, Ore, and Commod fields because it was not entered from file.",
66,"CH0770","CH0770","Yellow Pine Country Placer","1999-08-10 00:00:00","Updated Reference","Changed the reference from ""Campbell, 1932, Ann. Rept. of Mining Ind. of Id. for 1932"" to ""Campbell, 1923, 24th Ann. Rept. of Mining Ind. of Id. for 1922"" due to the information not being in the cited source.",
67,"CH0098","CH0098","Merritt Mine","1999-08-12 00:00:00","Added Production data","Added Period Production data, A ton of ore, and A oz of Au as per records.",
68,"CH1327","CH0098a","Gold Chain Placer","1999-08-12 00:00:00","Removed incorrect production data","Removed the production data from this column and changed it with that in CH  98b (North Star Mine)",
69,"CH0352","CH0352","Why Not Mine","1999-08-12 00:00:00","Corrected Production Data","Changed commodity and ore values in appropriate fields as per records.  Were higher in database than those on paper.  Ore:  F to C, Commod: Au: E to D; Ag, Cu: H to G, Removed ZN",
71,"CH0354","CH0354","Kwajalein","1999-08-12 00:00:00","Added Production Data","Added Production data as per records:  Ore: A ton    Commod: Ag: B oz; Cu: E lbs; Pb: C lbs  And PeriodProd: 1951",
72,"CH0358","CH0358","Jordan","1999-08-12 00:00:00","Added Production Data","Added Production data as per records:  PeriodProd:  1941, 1947, 1955  Ore:  C ton   Commod: Au: C oz; Ag: E oz",
73,"CH0363","CH0363","Golden Sunbeam Mine","1999-08-12 00:00:00","Corrected Production Data","Changed ore values in appropriate fields as per records:  Ore G to A ton",
74,"CH0369","CH0369","Ramshorn Mine","1999-08-12 00:00:00","Corrected Production Data","Changed ore and commod fields as per records:  Ore:  A to G ton",
75,"CH0050","CH0050","Dewey Mine","1999-08-12 00:00:00","Changed Production Data","Changed Ore Value as per records.  It was listed as ""E yds, actually ""H"" yds     /d yds",
76,"CH0069","CH0069","Sunnyside Mine","1999-08-12 00:00:00","Changed Production Data","Changed Ore Value as per records from ""E"" yds to ""G yds/A yds""",
77,"CH0430","CH0430","Lucky Boy Mine","1999-08-12 00:00:00","Changed Production Data","Changed Ore Value from A ton/G ton to H ton/G ton.",
78,"CH0531","CH00531","Silver Rule Mine","1999-08-12 00:00:00","Added Production Data","Added Prod data as per records:  PeriodProd 1914, 1948, 1949;  Ore: A ton;   Commod: Au: A oz; Ag: E oz; Cu: D lbs;Pb: G lbs; Zn: E lbs",
79,"CH0654","CH00654","Warm Springs Ccreek","1999-08-12 00:00:00","Added Production Data","Added Prod data as per records:  PeriodProd 1939;   Ore:  A ton;  Commod:  Ag: A oz; Pb: C lbs; Zn",
80,"CH0664","CH00664","Eureka Silver King","1999-08-12 00:00:00","Added Production Data","Added Prod data as per records:  PeriodProd 1948, 1950, 1957;    Ore B ton;   Commod:  Au: A oz; Ag: G oz; Cu: C lbs; Pb: E lbs",
81,"CH0670","CH00670","Deadwood Mine","1999-08-12 00:00:00","Added Production Data","Added Prod data as per records:  PeriodProd 1950;      Ore:  A ton;   Commod:  Au: A oz; Ag: D oz; Cu: D lbs; Pb: E lbs; Zn: E lbs",
82,"CH0671","CH00671","Lost Pilgrim Mine","1999-08-12 00:00:00","Added Production Data","Added Prod data as per records:  PeriodProd 1929-1931, 1939-1947  Ore: I ton  Commod:  Au: E oz; Ag: J oz; Cu: I lbs; Pb: L lbs; Zn: O lbs",
83,"CH0684","CH00684","Mary Jane","1999-08-12 00:00:00","Added Production Data","Added Prod data as per records:  PeriodProd 1904, 1925, 1932, 1934   Ore: C ton    Commod:  Au: B oz; Ag: A oz",
84,"CH0686","CH00686","Mary Blue","1999-08-12 00:00:00","Added Production Data","Added Prod data as per records:  PeriodProd 1905 -1914, 1923 -1927, 1931 -1933  Ore:  E ton   Commod:  Au: E oz; Ag: E oz; Cu: A lbs; Pb: B lbs Zn",
85,"CH0730","CH00730","Viking","1999-08-12 00:00:00","Added Production Data","Added Prod data as per records:  PeriodProd 1938,  1942-1944   Ore:  C ton   Commod:  Au: B oz; Ag: A oz",
86,"CH0783","CH00783","New Hope (Hancock)","1999-08-12 00:00:00","Added Production Data","Added Prod data as per records:  PeriodProd 1909, 1911     Ore:  A  ton    Commod: Au: A oz;  Ag A oz",
87,"CH0836","CH00836","Trappers Flat","1999-08-12 00:00:00","Added Production Data","Added Prod data as per records:  PeriodProd 1906              Ore:  B ton     Commod: Au: A oz; Ag: A oz",
88,"CH0930","CH00930","Cougar Mine","1999-08-12 00:00:00","Added Production Data","Added Prod data as per records:  PeriodProd 1936, 1937     Ore:  B ton     Commod: Au: C oz; Ag: C oz; Pb: C lbs",
89,"CH0934","CH00934","Lucky Lad Mine","1999-08-12 00:00:00","Changed Production Data","Changed Prod fields as follows as per records:  Ore: ""B ton"" --> ""D ton""   Commod: Au: ""A"" to ""D"";    no change in rest",
90,"CH0997","CH00997","Homestake Mine","1999-08-12 00:00:00","Changed Commod Field","Changed Prod fields as follows as per records:  Commod:  Ag to Ag: B oz",
91,"CH1021","CH01021","Golden Day","1999-08-12 00:00:00","Added Production Data","Added Prod data as per records:  PeriodProd 1937    Ore:  A ton   Commod:  Au: A oz; Ag: A oz; Pb: C lbs",
92,"CH1099","CH01099","Elk Creek Mine","1999-08-12 00:00:00","Changed Production Data","Changed Prod fields as follows as per records:  Ore:  From ""D ton/A ton"" to ""C ton""",
93,"CH1208","CH01208","Clayton Mine","1999-08-12 00:00:00","Changed Production Data","Changed Prod fields as follows as per records:  Ore ""A ton"" to ""K ton""",
94,"CH1232","CH1232","Redbird Mine","1999-08-12 00:00:00","Changed Production Data","Changed Prod fields as follows as per records: Ore ""D ton"" to ""H ton""",
95,"CH1249","CH01249","Katherine","1999-08-12 00:00:00","Added Production Data","Added Prod data as per records:  PeriodProd 1916, 1917     Ore:  A ton    Commod:  Ag: D oz; Cu: D lbs; Pb: G lbs",
96,"CH1272","CH1272","Hoodoo Prospects","1999-08-12 00:00:00","Changed Production Data","Changed Prod field as follows as per records: Ore from ""G ton"" to ""H ton""",
97,"CH1283","CH1283","Livingston Mine","1999-08-12 00:00:00","Changed Production Data","Changed Prod field as follows as per records:  Ore from ""G ton/A ton"" to ""H ton/H ton""",
98,"CH0069a","CH00069a","Sunnyside Mine","1999-08-12 00:00:00","Added Production Data","Added Prod data as per records:  PeriodProd 1936-1940   Ore E yds    Commod: Au: C oz; Ag: C oz",
99,"CH0106","CH00106","High Bar Placer","1999-08-12 00:00:00","Changed Production Data","Changed Prod field as follows as per records:  Commod:  Au: From ""E"" to ""A"".   It was hard to decipher the ""."" in the number.",
100,"CH0462","CH0462","Stanley Five Placers","1999-08-12 00:00:00","Changed Production Data","Changed Prod field as follows as per records:  Ore:  From A yds to G yds",
101,"CH0683","CH00683","Deadwood Placer Deposit","1999-08-12 00:00:00","Added Production Data","Added Prod data as per records:  PeriodProd  1901, 1907, 1908    Ore Unknown yards      Au:  D oz; Ag: B oz",
102,"CH0722","CH00722","Gold Nugget","1999-08-12 00:00:00","Added Production Data","Added Prod data as per records:  PeriodProd  1935 -1941   Ore:  E yds     Commod:  Au: B oz, Ag: A oz",
103,"CH0763","CH00763","Missouri Ridge","1999-08-12 00:00:00","Added Production Data","Added Production data as per records:  PeriodProd  1938            Ore:  B yds     Commod:  Au: A oz",
104,"CH0458","CH00458","Buckley Bar Placer","1999-08-13 00:00:00","Added Production Data","Added Prod data as per records:  PeriodProd 1940;        Ore:  A ton;       Commod:  Au:  A oz",
105,"DI0125","DI00125","Tormey Mine","1999-08-13 00:00:00","Added Production Data","Added Prod data as per records:  PeriodProd 1918 -1920, 1952-1957, 1971-1973  Ore:  E ton/A ton    Commod:  Au: A oz; Ag: D oz; Cu: I lbs",
106,"DI0130","DI0130","Pope-Shenon","1999-08-13 00:00:00","Changed Production Data","Changed Cu quantity in Commod field as per report, appears to have been a lookup error.",
107,"DU0056","DU0056","Blue Bird Mine (Bluebird)","1999-08-13 00:00:00","Added Production Data","Added Prod data as per records:  PeriodProd 1917, 1951, 1952    Ore:  A ton/A ton     Commod:  Au:  A oz; Ag:  B oz;  Cu:  E lbs",
108,"DU0064","DU0064","Copper Queen Mine","1999-08-13 00:00:00","Changed Production Data","Changed Prod data as per records as follows:   Ore:  From ""E ton/E ton""  To ""G ton/E ton""",
109,"DU0112","DU0112","Dixie Claim Group","1999-08-13 00:00:00","Added Production Data","Added Prod data as per records:  PeriodProd 1905, 1910, 1916, 1924, 1926, 1916, 1956, 1958   Ore: C ton     Commod:  Au: A oz; Ag: E oz; Cu: E lbs; Pb: I lbs; Zn: E lbs",
110,"DU0177","DU0177","Snowslide","1999-08-13 00:00:00","Changed Production Data","Changed Prod data as per records as follow:  Added the value for Zn to the commod field as it was omitted.",
111,"EC0014","EC0014","Congress Group Placer","1999-08-17 00:00:00","Updated Production Data","Changed Ore value from G yds to J yds as per records",
112,"EC0016p","EC0016a","Buster Mine","1999-08-17 00:00:00","Updated Production Data","Changed Ore value from K to I yds    Changed Commod field from   Au: G to F oz      changed PeriodProd years from 1948-1950 to 1904- 1910, 1921- 1954",
114,"EC0209","EC0209","McGovern and Hackney","1999-08-17 00:00:00","Updated Production Data","Changed Ore value from A to K yds",
115,"EC0210","EC0210","Warren Meadows","1999-08-17 00:00:00","Updated Production Data","Changed Ore value from A to Q",
116,"EC0224","EC0224","Steamboat Creek Placer","1999-08-17 00:00:00","Updated Production Data","Changed Ore value from G to K",
117,"EC0290","EC0290","Lucky Boy","1999-08-17 00:00:00","Added Production Data","Added Production Values as per records:  PeriodProd: 1936, 1948  Ore:  B yds  Commod: Au: A oz",
118,"EC0318","EC0318","Protection Claim","1999-08-17 00:00:00","Added Production Data","Added Production Values as per records:  PeriodProd: 1948- 1950  Ore:  K yds  Commod: Au: G oz; Ag: E oz",
119,"EC0729","EC0729","Buck Placer","1999-08-17 00:00:00","Changed Production Data","Changed Ore field as per record from G yds to I yds",
120,"EC0733","EC0733","Schissler Creek Placer","1999-08-17 00:00:00","Changed Production Data","Changed Ore field as per records from A yds to G yds",
121,"EC0875","EC0875","Last Chance Claim","1999-08-17 00:00:00","Added Production Data","Added Production Values as per records:  PeriodProd: 1935, 1937  Ore: D yds   Commod: Au: A oz; Ag: A oz",
122,"EC0876","EC0876a","Beaver Creek Placer","1999-08-17 00:00:00","Added Production Data","Added Production Values as per records:  PeriodProd:  1939          Ore: D yds   Commod: Au: A oz; Ag: A oz",
123,"EC1152","EC1152","Moose Creek placer","1999-08-17 00:00:00","Changed Production data","Changed Production Values as per records: Ore:  From G to I yds",
124,"EC1233","EC1233","Napias Creek Placer area","1999-08-17 00:00:00","Added Production Data","Added Production Values as per records:  PeriodProd: 1902-03, 1906, 1935- 1940, 1947, 1950, 1958- 59  Ore: E yds/C ton  Commod:  Au: C oz; Ag: A oz  RE",
125,"EC0419","EC0419","Crooked River","1999-08-17 00:00:00","Added Production Data","Added Production Values as per records:  PeriodProd: 1938 -1946     Ore:  J yds    Commod:  Au: F oz; Ag: E oz",
126,"EC1147","EC1147","Blue Moon","1999-08-17 00:00:00","Added Production Data",,
127,"EC0065","EC0065","Night Hawk","1999-08-17 00:00:00","Updated Production Data","Changed Produciton Values as per records: Ore: G yds (from A yds)",
128,"EC0579","EC0579","Little Moose","1999-08-17 00:00:00","Updated Production Data","Changed Production Data  Ore: From A to I yds",
129,"EC0035","EC0035","Ross","1999-08-17 00:00:00","Updated Production Data","Changed Production Data  Ore: From E yds to H yds",
130,"EC0042","EC0042","Red Horse Placer","1999-08-17 00:00:00","Updated Production Data","Changed Production Data  Ore: From G yds to I yds",
131,"EC0497","EC0497","Moose Creek Placers","1999-08-17 00:00:00","Updated Production Data","Changed Production Data  Ore: From A yds to I yds",
132,"EC0494","EC0494","Keyes Placer","1999-08-17 00:00:00","Updated Production Data","Changed Production Data  Ore: From A yds to H yds",
133,"EC0478","EC0478","Newsome Creek","1999-08-17 00:00:00","Updated Production Data","Changed Production Data  Ore: From G yds to K yds",
134,"EC0186","EC0186","Dixie Placers","1999-08-17 00:00:00","Updated Production Data","Changed Production Data  Ore: From G yds to I yds",
135,"EC0572","EC0572","Tyee Placer","1999-08-17 00:00:00","Updated Production Data","Changed Production Data  Ore: From A yds to J yds",
136,"EC0532","EC0532","Little Elk","1999-08-17 00:00:00","Updated Production Data","Changed Production Data  Ore: From G yds to I yds",
137,"EC0017","EC0017","Buffalo Gulch","1999-08-17 00:00:00","Added Production Data","Added Production Data  PeriodProd:  1934,1940, 1951  Ore: E yds  Commod:  Au: D oz; Ag: C oz",
138,"EC0023","EC0023","Cal- Idaho (Gold Hill)","1999-08-17 00:00:00","Updated Production Data","Changed Production Data  Ore:  From G yds to I yds",
139,"EC0022","EC0022","American River Mining Co","1999-08-17 00:00:00","Updated Production Data","Changed Production Data  Ore:  From F yds to J yds",
140,"EC0524","EC0524","Smith Placer","1999-08-17 00:00:00","Updated Production Data","Changed Production Data  Ore:  From A yds to G yds",
141,"EC0081","EC0081","Toby (Baker Gulch)","1999-08-17 00:00:00","Updated Production Data","Changed Production Data  Ore:  From A yds to G yds",
